{
  "kind": "petra-supported-content-matrix",
  "schemaVersion": 1,
  "version": "1.0.4",
  "supportedScenarios": [
    {
      "id": "flagship-ecoli-ciprofloxacin",
      "availability": "enabled-research",
      "scienceModeStatus": "not-admitted",
      "scenario": {
        "id": "ecoli-ciprofloxacin-spatial",
        "version": "1.5.0-research"
      },
      "organisms": [
        {
          "scientificName": "Escherichia coli",
          "background": "K-12 MG1655 for curated resistance phenotypes",
          "microbialGroup": "bacterium",
          "presentationIdentityId": "ecoli-k12-mg1655-representative-morphology-v1"
        }
      ],
      "environment": {
        "resourceContextVersion": "unbound-model-resource-v1",
        "resourceBindingStatus": "unbound",
        "resourceRepresentation": "dimensionless_model_resource",
        "medium": null,
        "referenceTemperatureC": 37
      },
      "interventions": [
        {
          "id": "ciprofloxacin",
          "kind": "antibiotic",
          "protocolCommand": "apply-ciprofloxacin",
          "concentrationUnit": "mg/L",
          "supportedGeometries": [
            "global",
            "radial",
            "stripe",
            "paint"
          ]
        }
      ],
      "limitations": [
        "This is a research-stage product scenario, not grounded Science-Mode admission: its limiting-resource context remains explicitly unbound and the ecology execution profile remains engineering-classified.",
        "The resource channel is model-resource, not a named physical substrate or concentration.",
        "The ciprofloxacin intervention edits the model concentration field; it does not establish physical delivery, diffusion, decay, clearance, or clinical dosing.",
        "The E. coli rod presentation identity authorizes only a coarse representative silhouette and is not biological checkpoint, replay, population-count, or physical-dimension authority."
      ]
    }
  ],
  "expansionQueue": [
    {
      "id": "first-shared-resource-bacterial-competitor",
      "kind": "bacterial-competitor",
      "availability": "blocked-validation",
      "issues": [
        907,
        946,
        999
      ],
      "reason": "The named E. coli MG1655 + Bacillus subtilis 168 trp+ sigE- authoritative model-unit scenario and exact inert content pack ecoli-bsubtilis-shared-resource-pack@1.0.0 are implemented, but product promotion is not yet evidence-complete. #907 owns provenance-complete local mechanistic/replay validation and remains the evidence gate; #946 owns the remaining exact presentation-binding hardening, and #999 owns fail-closed Sandbox/product registration after validation. Physical glucose/gCDW mapping, direct interaction, Bacillus ciprofloxacin/evolution, and sporulation remain unsupported."
    },
    {
      "id": "first-grounded-fungal-competitor",
      "kind": "fungal-competitor",
      "availability": "blocked-implementation",
      "issues": [
        615,
        974,
        1005,
        976
      ],
      "reason": "The supported Aspergillus niger var. hennebergi no. 10 agar-surface source-validation subset is implemented, but a live competitor is not yet authoritative. #974 still gates source-backed glucose/resource coupling, #615 owns the fungal mechanism, #1005 owns the shared composed Worker/checkpoint/replay transaction, and #976 may admit a live fungal render companion only after that shared runtime authority exists. Standalone source-validation time/front geometry must not be joined to bacterial runtime state by matching time alone; antimicrobial effect and direct cross-species kinetics remain unbound."
    },
    {
      "id": "first-post-ciprofloxacin-antibiotic",
      "kind": "antimicrobial",
      "availability": "blocked-research",
      "issues": [
        928,
        938
      ],
      "reason": "The source-backed MG1655 chloramphenicol numerical response authority is implemented, but the current dimensionless flagship model-resource cannot select or drive a Greulich MOPS nutrient family. #928 owns the exact environment/non-identifiability decision and #938 owns the MOPS-glucose resource-to-growth calibration/source-acquisition path; physical two-dimensional dish transport remains UNBOUND. Product support stays fail-closed until a source-compatible environment bridge supplies the required pre-drug growth context."
    },
    {
      "id": "named-microbial-interactions",
      "kind": "interaction",
      "availability": "blocked-research",
      "issues": [
        647
      ],
      "reason": "The exact E. coli K-12 MG1655 to Candida albicans SC5314 fungicidal phenotype is documented, but production, transport, loss, exposure-response, and magnesium-coupling authority remain unbound; generic attack/cooperation coefficients stay disabled under #647."
    }
  ]
}
